[
    {
        "countryOfOrigin": {
            "twoChar": "GB",
            "label": "Great Britain",
            "threeChar": "GBR"
        },
        "description": "Aromas of lavender, spice, honey, thyme, earthy flavors",
        "id": "ecb21890-d917-11e8-a50c-fd28cb3bfd5b",
        "label": "East Kent Golding",
        "aka": [
            "Kent Golding",
            "EKG",
            "Canterbury Golding"
        ]
    },
    {
        "countryOfOrigin": {
            "twoChar": "AU",
            "label": "Australia",
            "threeChar": "AUS"
        },
        "description": "Tropical fruit, pine, herbs",
        "id": "dcbf07f0-d88f-11e8-98ba-e35f1f7aa8a8",
        "label": "Vic Secret",
        "aka": [
            "Victoria",
            "Victoria’s Secret",
            "Victoria Secret"
        ]
    },
    {
        "countryOfOrigin": {
            "twoChar": "US",
            "label": "United States",
            "threeChar": "USA"
        },
        "id": "470b1340-ce6f-11e8-825b-5fbf22fdb82a",
        "description": "Grapefruit",
        "label": "Citra",
        "aka": [
            "Citra® Brand HBC 394 cv",
            "HBC394"
        ]
    },
    {
        "countryOfOrigin": {
            "twoChar": "US",
            "label": "United States",
            "threeChar": "USA"
        },
        "description": "Aroma variety with floral, blueberry, tangerine, papaya, rose blossoms, grass, earthy & bubble gum notes.",
        "id": "843e4740-d082-11e8-b04c-a55c5f6253ec",
        "label": "Mosaic",
        "aka": [
            "HBC369"
        ]
    }
]
